<?xml version="1.0" encoding="UTF-8"?>
<!-- 
    author: Borja
    date: 17/01/2023
    description: XML01
-->

<!DOCTYPE mail SYSTEM "01.dtd">

<mail xmlns:xsi="http://www.w3.org/2001/XMLSchema-instance" xsi:noNamespaceSchemaLocation="01.xsd">
    <remitente>
        pepe@gmail.com
    </remitente>
    <destinatario>
        gaz@gmail.com
    </destinatario>
    <destinatario>
        lauki@gamil.com
    </destinatario>
    <destinatario>
        cobreros@gmail.com
    </destinatario>
    <fecha>
        <dia>---17</dia>
        <mes>--01</mes>
        <anyo>2023</anyo>
    </fecha>
    <asunto>Los Quintos de Castrogonzalo 2023</asunto>
    <mensaje><![CDATA[ 
        1. Red Label
        2. Barcelo
        3. Seagram
        4. Cerveza
        5. Vino
        6. Agua
    ]]></mensaje>
    <image>
        <nombre>ismael1.jpg</nombre>
        <tipo>image/jpg</tipo>
    </image>
    <image>
        <nombre>ismael1.png</nombre>
        <tipo>image/png</tipo>
    </image>
</mail>